Page-Article,NS,IPD,LP,AN,CO,PG,WC,CX,TD,CLM,CR,PD,SE,HD,IN,BY,CY,LA,ED,RE,PUB,SC,SN,Search_Query_1,Search_Query_2,URL,Article_ID
2012-Page1-7,ghock : Field Hockey | nedc : Commentary/Opinion | npeo : People Profile | gspo : Sports/Recreation | ncat : Content Types | nfact : Factiva Filters | nfce : FC&E Exclusion Filter | nfcpex : FC&E Executive News Filter | nrgn : Routine General News,Oak Bay | Vancouver Island | Anniversaries | Biography | Developers | History | Hockey | Frank Patrick | Lester Patrick | Pacific Coast Hockey Association,"<p class=""articleParagraph enarticleParagraph"">VICTORIA -- tomhawthorn@gmail.com</p><p class=""articleParagraph enarticleParagraph"">The arena opened to great fanfare, a ticket sold for every seat, the standing room area packed to the building's timber rafters.</p>",Document GLOB000020120102e81200016,,S2,984 words,,"<p class=""articleParagraph enarticleParagraph"">A band struck up the national anthem as the lieutenant-governor entered the building. The hockey teams then skated onto the ice, the home side first, followed by the visitors.</p><p class=""articleParagraph enarticleParagraph"">The vice-regal officer stepped onto ice made hard and cold by an ingenious system of pipes beneath the surface. Thomas Wilson Paterson, a railway contractor and former politician, dropped the puck for a ceremonial opening faceoff.</p><p class=""articleParagraph enarticleParagraph"">One hundred years ago today, on Jan. 2, 1912, the exciting sport of ice hockey made its professional debut on Vancouver Island at a new arena built in Oak Bay, just outside the city of Victoria's boundaries.</p><p class=""articleParagraph enarticleParagraph"">“The sport is all it was cracked up to be and more,” trilled the Daily Times after the game.</p><p class=""articleParagraph enarticleParagraph"">“With all due reverence to cricket, we think hockey is a trifle faster.”</p><p class=""articleParagraph enarticleParagraph"">It seems hard to imagine a game now so deeply associated with Canadian identity needed any introduction at any time in the Dominion. Hockey was played in the province, especially in the mining towns in the frozen valleys of the Kootenays, but fair weather on southern Vancouver Island permitted only the occasional children's game of shinny on a frozen shallow pond.</p><p class=""articleParagraph enarticleParagraph"">On that day a century ago, the seven players of the New Westminster Royals sailed across the strait to play the Victoria Senators in the inaugural game of the three-team Pacific Coast Hockey Association.</p><p class=""articleParagraph enarticleParagraph"">The modern arena with artificial ice, as well as the three teams and the league in which they played, were the creation of Frank and Lester Patrick, ambitious and far-sighted brothers who had made a fortune with their father in the lumber business.</p><p class=""articleParagraph enarticleParagraph"">The brothers played pro hockey back east. They figured another fortune was to be made in promoting the sport in the booming Pacific port cities. They intended to challenge for the Stanley Cup, which even then inspired fevered dreams of hockey glory.</p><p class=""articleParagraph enarticleParagraph"">In Vancouver, they built a grand $175,000 arena on Georgia Street overlooking Coal Harbour. The Denman Arena, as it came to be known, boasted a seating capacity of 10,000, making it the largest in the Dominion. Incredibly, the city's population was just 120,000, though it had doubled in five years and the Patricks anticipated further growth.</p><p class=""articleParagraph enarticleParagraph"">In Victoria, they built a more modest, but still modern, building of wood. It stood at the corner of Cadboro Bay Road and what is now Epworth Street. (The arena burned to the ground in the early morning hours of Remembrance Day in 1929. The flames, first spotted by a passing milkman, lit up the night sky. The site is now occupied by a pair of three-storey apartment blocks across the street from the Oak Bay Secondary sporting grounds.)</p><p class=""articleParagraph enarticleParagraph"">The world-class arenas helped lure to the coast some of the best-known names in hockey, including Newsy Lalonde, Harry Hyland and Tom Dunderdale. (The Vancouver Millionaires also employed a 19-year-old player called Silent Jack Ulrich, as he was deaf and mute.)</p><p class=""articleParagraph enarticleParagraph"">The Royals wore black and orange sweaters, while the Senators sported a red, white and blue combination.</p><p class=""articleParagraph enarticleParagraph"">The sportswriters wrote in purple.</p><p class=""articleParagraph enarticleParagraph"">“Every moment provided a fresh sensation and never while playing was going on was the blood given time to cool,” ran a report in the Daily Times. “As the puck darted hither and thither with such dazzling rapidity that at times it was impossible for the crowd to follow its course, the most phlegmatic were stirred to their deepest depths; as spectacular burst crowded upon spectacular burst in almost unending succession, this unrestrained delight brought the spectators up all standing.”</p><p class=""articleParagraph enarticleParagraph"">Of course the referee came in for criticism from the Daily Colonist for having missed “one or two roughhouse stunts.”</p><p class=""articleParagraph enarticleParagraph"">The Victoria arena opened to the public with an offer of free skating on Christmas Day, leading several downtown stores to advertise a new stock of equipment, with the cheapest pair of men's “skating boots” available for $2.50.</p><p class=""articleParagraph enarticleParagraph"">Victoria lost the first game at the arena by 8-3. In goal for the home side was 31-year-old veteran Bert Lindsay, whose son also became a hockey star. Terrible Ted Lindsay is now 86.</p><p class=""articleParagraph enarticleParagraph"">The Patricks are credited with such innovations as forward passing, adding bluelines and substituting skaters while play continued. They also sold franchises to interests in Seattle and Portland, Ore., creating an international major pro league a decade before the National Hockey League allowed a New England grocery-store magnate to enter their league with the Boston Bruins.</p><p class=""articleParagraph enarticleParagraph"">At the end of the short 1912 season, Frank Patrick suggested the Stanley Cup be decided by a series of games, not just a two-game playoff, as was the practice.</p><p class=""articleParagraph enarticleParagraph"">His league sent a letter to the Stanley Cup trustees offering to send a champion by train to Eastern Canada to challenge for the trophy. The suggestion was rejected, as the natural ice used in rinks in Montreal, Toronto and Quebec City would be too slushy by late March. By the end of 1912, the Arena Gardens (later known as the Mutual Street Arena) in Toronto had artificial ice. It was the way of the future of pro hockey.</p><p class=""articleParagraph enarticleParagraph"">These days, the Stanley Cup finals end in balmy June. And the storied trophy has even been won by a team in Florida.</p><p class=""articleParagraph enarticleParagraph"">A forgotten arena in Victoria was once the stage that showed how such wonders were possible.</p>",EYES ON THE ISLAND,SPECIAL TO THE GLOBE AND MAIL,2 January 2012,British Columbia News: Column,"Vancouver Island's hockey century; When the new pro sport made its debut, locals believed that ‘with all due reverence to cricket, we think hockey is a trifle faster'",,TOM HAWTHORN   ,©2012 The Globe and Mail Inc. All Rights Reserved.   ,English,,cana : Canada | vancv : Vancouver | cabc : British Columbia | namz : North America,The Globe and Mail Inc.,GLOB,The Globe and Mail,A band struck up the national anthem as the lieutenant-governor,"The vice-regal officer stepped onto ice made hard and cold by an ingenious system of pipes beneath the surface. Thomas Wilson Paterson, a railway contractor and former politician, dropped the puck for a ceremonial opening faceoff.",http://www.theglobeandmail.com/news/british-columbia/a-centennial-for-ice-hockey-on-vancouver-island/article1357321/,1357321
2012-Page2-55,gsoc : Social Issues | gvjus : Justice Department | gcrim : Crime/Courts | ghum : Human Rights/Civil Liberties | gimm : Asylum/Immigration | gpol : Domestic Politics | nedi : Editorial | gcat : Political/General News | gcom : Society/Community/Work | gpir : Politics/International Relations | gvbod : Government Bodies | gvexe : Executive Branch | ncat : Content Types,Canada | Civil rights | Family law | Homosexuals | Immigrants | International law | Political | Same-sex marriage | Rob Nicholson,"<p class=""articleParagraph enarticleParagraph"">The federal Justice Department insisted in a lesbian divorce case this week that Canada accept the discrimination of other jurisdictions. If foreign gays and lesbians who received marriage licences in this country could not be married back home, they are not legally married, the Justice Department said.</p><p class=""articleParagraph enarticleParagraph"">It is an untenable, mechanistic argument – that the “law of domicile,” in effect, defeats the Canadian Constitution. Impossible. And unjust. And it is good to hear Justice Minister Rob Nicholson promise to fix this injustice.</p>",Document GLOB000020120113e81d00020,,A12,393 words,,"<p class=""articleParagraph enarticleParagraph"">The case involves a woman from Florida and one from the United Kingdom. They could not be married in either jurisdiction.</p><p class=""articleParagraph enarticleParagraph"">Ontario granted them a marriage licence in 2005. Yet Canada said in a Toronto court that they can't divorce, because no marriage exists between them.</p><p class=""articleParagraph enarticleParagraph"">Thousands of years of laws and traditions did not stop this country's courts, and ultimately its federal Parliament, from legalizing gay marriage. What is the “law of domicile” (the legal capacity to marry in the place where one lives) next to the mighty and seemingly timeless law of man and woman in matrimony? Yet that law – of marriage reserved for man and woman – fell in Canada.</p><p class=""articleParagraph enarticleParagraph"">The higher law, of equality and human dignity, as protected by the Charter of Rights and Freedoms, has changed the basic rules of marriage in Canada. Marriage presupposes a right to divorce, so couples may move on with their lives. And there are sound policy reasons for extending those rights to those from foreign jurisdictions who got married in Canada – to protect the interests of any children involved, for instance. It would also be the just thing to do to continue allowing gay marriage of foreign visitors, and to facilitate divorce, where necessary, by waiving one-year residency requirements in Canada.</p><p class=""articleParagraph enarticleParagraph"">The Justice Department has an obligation to fix the anomalous situation facing many of the 5,000 gay couples who came to Canada to marry.</p><p class=""articleParagraph enarticleParagraph"">It is more than an anomaly – it's a humiliation, for the couples and the jurisdictions, such as Ontario, that welcomed them here, accepted their tourist dollars and gave them the marriage licences.</p><p class=""articleParagraph enarticleParagraph"">This country legalized gay marriage to end exclusion – without ifs, ands or anomalies. Within Canadian borders, all rules on marriage and divorce should start from the premise of inclusion.</p>",SAME-SEX / DIVORCE,,13 January 2012,Editorial,Domicile should have no veto,,,©2012 The Globe and Mail Inc. All Rights Reserved.   ,English,,cana : Canada | caon : Ontario | namz : North America,The Globe and Mail Inc.,GLOB,The Globe and Mail,The case involves a woman from Florida and one from,"Ontario granted them a marriage licence in 2005. Yet Canada said in a Toronto court that they can't divorce, because no marriage exists between them.",http://www.theglobeandmail.com/opinion/editorials/law-of-domicile-should-have-no-veto-on-the-constitution/article1358282/,1358282
2012-Page2-76,e211 : Government Taxation/Revenue | gpol : Domestic Politics | nedc : Commentary/Opinion | e21 : Government Finance | ecat : Economic News | gcat : Political/General News | gpir : Politics/International Relations | ncat : Content Types | nfact : Factiva Filters | nfcpex : FC&E Executive News Filter,Toronto | Budget | Government finance | Political | Rob Ford,"<p class=""articleParagraph enarticleParagraph"">mgee@globeandmail.com</p><p class=""articleParagraph enarticleParagraph"">When officials announced this month that Toronto was posting an unexpectedly big budget surplus of $154-million for 2011, critics of Mayor Rob Ford let out a triumphant “aha.” Here, they crowed, was proof of what they had been saying all along. The city was not in such bad financial shape after all. Mr. Ford had manufactured a crisis to justify spending cuts that were simply not needed.</p>",Document GLOB000020120114e81e0002c,,A14,609 words,,"<p class=""articleParagraph enarticleParagraph"">It proved nothing of the sort. The city often finds itself with sudden windfalls at year-end when tax revenues come in higher or spending lower than expected. Because Toronto is required by law to have a balanced budget, officials are careful to make conservative projections at the start of the year, giving themselves some leeway when the bills come due. The result is often a tidy, and tempting, year-end surplus.</p><p class=""articleParagraph enarticleParagraph"">For years, the city has been using part of this money to cover expenses for the year to come. It is like relying on sofa-cushion money to pay the mortgage. It is not part of the household budget and you can't count on it. It means that the city is paying its bills with unsustainable, unpredictable revenue, leaving it to begin each annual budget struggle from behind the eight ball.</p><p class=""articleParagraph enarticleParagraph"">This is a sloppy, unwise practice and Mr. Ford is right to want to end it. City finance officials have been saying for years that Toronto should quit relying on windfall money to plug its annual budget gap. Using the temporary surpluses and dipping into reserves only masks the fact that, in truth, the city's spending chronically exceeds its permanent revenue. This “structural deficit” has dogged the city's books for years, making it hard to find the wherewithal to pay for critical needs.</p><p class=""articleParagraph enarticleParagraph"">Now, at long last, the city is moving to close that chasm. This year, instead of using its windfall to pay for current programs its income won't support, it plans to put aside the extra $154-million for future needs. A proposal from the city's executive committee, which will go to city council next week, would see the money go toward a fund for TTC capital projects like the purchase of new streetcars.</p><p class=""articleParagraph enarticleParagraph"">Chief financial officer Cam Weldon said this week that by preserving rather than spending the windfall, the new budget approach “takes us a long way to fiscal sustainability.”</p><p class=""articleParagraph enarticleParagraph"">Unfortunately, if predictably, the mayor's critics are not listening. No sooner did city officials announce their new surplus numbers than city council's left erupted in outrage at the mayor. How dare he try to cut services when he had all that extra cash to pay for them? Why would he put away money for a rainy day with $154-million in hand?</p><p class=""articleParagraph enarticleParagraph"">“As if it isn't a rainy day when even wading pools are deemed unaffordable,” huffed the Toronto Star, referring to the unspeakably cruel decision to close five city wading pools that are underused and in need of repair.</p><p class=""articleParagraph enarticleParagraph"">In truth, the Ford administration has shown itself quite willing to use new-found resources to save services that face the chop. Mr. Ford is backing a staff proposal to save threatened student-nutrition programs and community centres by dipping into an extra $8.8-million income from the property tax. But here is the difference: This money comes from permanent growth in tax assessments, not a one-time windfall.</p><p class=""articleParagraph enarticleParagraph"">Using that kind of ongoing income to pay for ongoing needs make sense. Using cushion money does not.</p>",CITY POLITICS,,14 January 2012,Column,Ford is right not to rely on unpredictable windfalls,,MARCUS GEE   ,©2012 The Globe and Mail Inc. All Rights Reserved.   ,English,,caon : Ontario | toron : Toronto | cana : Canada | namz : North America,The Globe and Mail Inc.,GLOB,The Globe and Mail,It proved nothing of the sort. The city often finds,"For years, the city has been using part of this money to cover expenses for the year to come. It is like relying on sofa-cushion money to pay the mortgage. It is not part of the household budget and you can't count on it. It means that the city is paying its bills with unsustainable, unpredictable r",http://www.theglobeandmail.com/news/toronto/rob-ford-is-right-not-to-rely-on-unpredictable-windfalls/article4170907/,4170907
2012-Page1-86,ghum : Human Rights/Civil Liberties | gpol : Domestic Politics | gvote : Elections | nedc : Commentary/Opinion | npeo : People Profile | gcat : Political/General News | gcom : Society/Community/Work | gpir : Politics/International Relations | ncat : Content Types | nfact : Factiva Filters | nfcpex : FC&E Executive News Filter,New Hampshire | United States | Biography | Candidates | Elections | Human rights | Political | Primaries | Rick Santorum | Republican Party,"<p class=""articleParagraph enarticleParagraph"">MANCHESTER, N.H. -- kyakabuski@globeandmail.com</p><p class=""articleParagraph enarticleParagraph"">When Rick Santorum began his improbable presidential run last June, half of Republican voters had never heard of him. Even after a dozen debates, he was just as unknown.</p>",Document GLOB000020120107e8170002v,,A14,915 words,,"<p class=""articleParagraph enarticleParagraph"">One group has long been well acquainted with him, however. And it is not the social conservatives behind his stunning tie for first place in this week's Iowa caucuses.</p><p class=""articleParagraph enarticleParagraph"">Gay rights activists have considered Mr. Santorum a menace since his 2003 outburst against a Supreme Court decision striking down anti-sodomy laws. They have ensured that, even after he lost his Senate seat in 2006, Mr. Santorum's name has lived on in infamy.</p><p class=""articleParagraph enarticleParagraph"">Thus was born the noun “santorum” – a word whose definition is so unsavoury the ex-senator has been trying to get <span class=""companylink"">Google</span> to remove it from its search engine.</p><p class=""articleParagraph enarticleParagraph"">But as Mr. Santorum comes under scrutiny as potentially the only candidate able to stop Mitt Romney, he is discovering there is no erasing one's past in politics or cyberspace.</p><p class=""articleParagraph enarticleParagraph"">The sudden attention could take him down or rehabilitate the meaning of his name.</p><p class=""articleParagraph enarticleParagraph"">The Republican base still craves a candidate who can beat the “Massachusetts moderate” – as the fast fading Newt Gingrich calls Mr. Romney. Mr. Santorum may be poised to ride a conservative wave, if not to the nomination, perhaps to a place on the GOP ticket.</p><p class=""articleParagraph enarticleParagraph"">As unlikely as that seems, it did not stop Carl Toepel, 72, from braving the nippy temperature to hold up a sign reading “Romney/Santorum” at a rally for the ex-senator here on Friday. The overflow crowd forced organizers to move the event outside.</p><p class=""articleParagraph enarticleParagraph"">“This is like a Fellini movie,” Mr. Santorum, a boyish 53, quipped as he surveyed the crush of fans, hecklers and reporters before him in the parking lot of a local banquet hall.</p><p class=""articleParagraph enarticleParagraph"">As recently as a couple of weeks ago, Mr. Santorum would probably have found it hard to lure more than a dozen or so supporters to an event here. Suddenly, he's a draw.</p><p class=""articleParagraph enarticleParagraph"">“I was telling people about him a long time ago,” crowed Sue Phillips, 80, as she waited for Mr. Santorum. “I do believe he could take it to Obama, tell him what's what.”</p><p class=""articleParagraph enarticleParagraph"">Mr. Santorum is unlikely to give Mr. Romney much trouble in New Hampshire, where evangelical Christians will account for, at best, one-fifth of voters in Tuesday's GOP primary. But a top-three finish in the Granite State would confirm his momentum.</p><p class=""articleParagraph enarticleParagraph"">A bigger test will come on Jan. 21 in South Carolina. Evangelicals make up more than half of GOP primary voters there and two polls on Friday showed Mr. Santorum surging into second behind Mr. Romney in the Palmetto State. He may peak at just the right time.</p><p class=""articleParagraph enarticleParagraph"">Then again, he started out as a footnote in the GOP race and could still end up there as his rivals step up their attacks and the news media shine the spotlight his controversial career in the Senate, where he displayed a penchant for inflammatory metaphors and crass cultural warfare.</p><p class=""articleParagraph enarticleParagraph"">The son of an Italian immigrant who grew up a staunch Catholic in Pennsylvania coal country, Mr. Santorum became an anti-abortion crusader after the stillbirth of a son in 1990.</p><p class=""articleParagraph enarticleParagraph"">It is no exaggeration to say that strengthening the family is the cornerstone of his economic platform. He draws a direct link between the breakdown of the traditional family and spiralling government debt.</p><p class=""articleParagraph enarticleParagraph"">“Governments get bigger,” he argues, “when families get weaker.”</p><p class=""articleParagraph enarticleParagraph"">In 2005, he wrote It Takes a Family, which served as his rebuttal to Hillary Clinton's It Takes a Village, her 1996 book on the importance of non-family members on children's welfare.</p><p class=""articleParagraph enarticleParagraph"">But it is his relentless antipathy toward gay rights that truly makes him stand out.</p><p class=""articleParagraph enarticleParagraph"">“He is not just someone who is opposed to equality,” said Michael Cole-Schwartz, a spokesman for the Human Rights Campaign. “He has made it his life's work.”</p><p class=""articleParagraph enarticleParagraph"">Speaking to college students here on Thursday, he baited a questioner who argued that the right to happiness was enough of a justification to make gay marriage legal.</p><p class=""articleParagraph enarticleParagraph"">“If you're not happy unless you're married to five other people, is that okay too?” Mr. Santorum shot back amid boos from the audience.</p><p class=""articleParagraph enarticleParagraph"">His take-no-prisoners approach reassures social conservatives, who consider Mr. Romney wishy-washy on the issues important to them. They have no such doubts about Mr. Santorum, who, with his wife, Karen, home-schools their seven children.</p><p class=""articleParagraph enarticleParagraph"">But as the focus shifts to Mr. Santorum's career in the Senate, where he was a top beneficiary of donations from lobbyists and earned a reputation for pork-barrel politics, he will face a hard time winning over Tea Party Republicans and fiscal conservatives.</p><p class=""articleParagraph enarticleParagraph"">The revelation that he earned lucrative director and consulting fees after leaving the Senate from companies that were major donors when he was in office will not help his campaign, either.</p><p class=""articleParagraph enarticleParagraph"">His rivals for the nomination are likely preparing attack ads with all the gory details.</p><p class=""articleParagraph enarticleParagraph"">Still, Mr. Santorum has already accomplished more than he could have hoped for at the outset of his presidential bid.</p><p class=""articleParagraph enarticleParagraph"">Now, at least, everybody knows his name.</p>",GOP NOMINATION,,7 January 2012,Column,"A Republican menace or a messiah? Crusader against gay rights and champion for evangelicals, Santorum will either end up a footnote or take a place on GOP ticket",,KONRAD YAKABUSKI   ,©2012 The Globe and Mail Inc. All Rights Reserved.   ,English,,usa : United States | namz : North America,The Globe and Mail Inc.,GLOB,The Globe and Mail,"One group has long been well acquainted with him, however.","Gay rights activists have considered Mr. Santorum a menace since his 2003 outburst against a Supreme Court decision striking down anti-sodomy laws. They have ensured that, even after he lost his Senate seat in 2006, Mr. Santorum's name has lived on in infamy.",http://www.theglobeandmail.com/news/world/rick-santorum-a-republican-menace-or-a-messiah/article1357849/,1357849
