Page-Article,NS,IPD,LP,AN,CO,PG,WC,CX,TD,CLM,CR,PD,SE,HD,IN,BY,CY,LA,ED,RE,PUB,SC,SN,Search_Query_1,Search_Query_2,URL,Article_ID
2012-Page2-31,gplan : Urban Planning/Development | ccat : Corporate/Industrial News | nedc : Commentary/Opinion | gcat : Political/General News | gpir : Politics/International Relations | gpol : Domestic Politics | ncat : Content Types | nfact : Factiva Filters | nfcpex : FC&E Executive News Filter,Vancouver | Historic buildings | History | Internet | Photography | Technology | Weblogs,"<p class=""articleParagraph enarticleParagraph"">VANCOUVER -- tomhawthorn@gmail.com</p><p class=""articleParagraph enarticleParagraph"">The garage is a utilitarian wonder, a concrete box standing seven storeys tall on a downtown Vancouver street corner. An interior series of ramps winds to the rooftop, where painted stalls provide room for yet another 58 automobiles.</p>",Document GLOB000020120111e81b0001l,,S2,882 words,,"<p class=""articleParagraph enarticleParagraph"">From that roof one can marvel at the neo-classical beauty of Waterfront Station across West Cordova Street, as well as the mixed art deco and Edwardian Baroque magnificence of the Sinclair Centre across Granville Street.</p><p class=""articleParagraph enarticleParagraph"">It is much better to be in the garage looking out than to be outside looking in. The garage, built in 1969, is an ugly, dreary blot on the landscape. The garage's opened façade is like a grim stack of grey concrete pancakes.</p><p class=""articleParagraph enarticleParagraph"">The site was not always so unwelcoming.</p><p class=""articleParagraph enarticleParagraph"">Once, a strip of mom-and-pop businesses operated on the block. A photograph taken during the war years depicts well-dressed couples strolling past businesses with opened doors.</p><p class=""articleParagraph enarticleParagraph"">The two images – the sterile parking garage and the vibrant street of shops – are paired in a fascinating new blog called Changing Vancouver. The site matches then and now photographs taken at the exact same location.</p><p class=""articleParagraph enarticleParagraph"">Launched on Christmas Day, the blog – at changingvancouver.wordpress.com – already has more than 50 entries complete with historical background and information on architects and builders.</p><p class=""articleParagraph enarticleParagraph"">It is an irresistible time waster.</p><p class=""articleParagraph enarticleParagraph"">The blog is produced by Andy Coupland, a London-born city hall planner, and John Atkin, the historian and heritage advocate. It is a follow-up to The Changing City, their book of walking tours published last year by Stellar Press.</p><p class=""articleParagraph enarticleParagraph"">The contemporary photographs are shot by Mr. Coupland (pronounced coop-land), who strolls city sidewalks armed with a digital camera, a tripod and a wallet of black-and-white prints as he seeks the precise spot where the historical photographs were taken. It is not as easy a task as it sounds and even somewhat hazardous.</p><p class=""articleParagraph enarticleParagraph"">“A lot of them were set up standing in the middle of traffic,” he said. “That is quite problematic.”</p><p class=""articleParagraph enarticleParagraph"">Sometimes, the before-and-after images are surprisingly similar. (A trio of buildings facing the northeast corner of Victory Square remains intact.) Other times, it is hard to imagine what has forever disappeared. That ordinary, ho-hum, never-give-it-a-second-glance Standard Life Building office tower at Howe and Dunsmuir? It stands on ground once occupied by the many-gabled Manor House Hotel, which boasted a wraparound porch on all three levels, as well as a bell tower overlooking the intersection. The Manor House was designed by William Blackmore, a British-born architect who skipped debts in Winnipeg and Minneapolis to set up practice in Vancouver a year after the city was founded.</p><p class=""articleParagraph enarticleParagraph"">One of the blog's most shocking contrasts is the pairing of today's parking garage with yesterday's modest shops at the corner of Granville and Cordova.</p><p class=""articleParagraph enarticleParagraph"">“That single storey is so much more interesting than the parking garage,” Mr. Coupland said. “It's interesting how busy that corner used to be, and how dead it is now.”</p><p class=""articleParagraph enarticleParagraph"">In that one block, now relegated to memory, can be told the story of a city.</p><p class=""articleParagraph enarticleParagraph"">Along Granville Street could be found a lunch counter and an office of the Railway Express Agency, which shipped parcels. There was also a barber shop operated by James Willows; the Wigwam novelty store offering native crafts and Japanese porcelain; and a furrier. The corner was occupied by Wilson's, described as the Post Office News Stand in the city directory.</p><p class=""articleParagraph enarticleParagraph"">A star-shaped neon sign advertised the Star Weekly magazine, while other exterior signs promoted <span class=""companylink"">Coca-Cola</span> and Sweet Caporal cigarettes. The newsstand is open to both Granville and Cordova Streets, attracting customers from the train station (now Waterfront Station) and the post office (now Sinclair Centre).</p><p class=""articleParagraph enarticleParagraph"">The adjacent fur store was founded by the Lando family. Lou and Sara Lando's son, Esmond (Bud) Lando became a prominent lawyer and sportsman in the city, while his wife, Edith, was named to the Order of Canada as a “quintessential volunteer.” Their children are known for their own volunteer and philanthropic work. One of them, Barry Lando, worked for a quarter-century as a producer on CBS's 60 Minutes.</p><p class=""articleParagraph enarticleParagraph"">All of which is more interesting than a parking garage.</p><p class=""articleParagraph enarticleParagraph"">While the blog has so far used archival photos, Mr. Atkin is dipping into his extensive collection of private, never-before-seen photos dating from more recent decades.</p><p class=""articleParagraph enarticleParagraph"">Among these is a 1962 shot of the Courtesy Kitchen, serving Chinese and Canadian food, at the corner of East Broadway and Scotia. Next door, a one-time foresters hall houses a shop selling foam.</p><p class=""articleParagraph enarticleParagraph"">Today, both buildings have survived. The former Courtesy Kitchen is now home to the pleasant Rhizome Café, while the foam store, which has also been a confectionery, a print shop and a strip joint, is home to <span class=""companylink"">Starbucks</span>.</p><p class=""articleParagraph enarticleParagraph"">At least it was the last time I checked. In Vancouver, you never know what's going to be there in the morning.</p>",NOSTALGIA,SPECIAL TO THE GLOBE AND MAIL,11 January 2012,British Columbia News: Column,Vancouver snapshots - then and now; An irresistible new blog matches contemporary photographs with archival ones taken in exactly the same locations,i3733 : Photographic Equipment | icnp : Consumer Products | ilgood : Leisure/Travel Goods,TOM HAWTHORN   ,©2012 The Globe and Mail Inc. All Rights Reserved.   ,English,,cana : Canada | cabc : British Columbia | vancv : Vancouver | namz : North America,The Globe and Mail Inc.,GLOB,The Globe and Mail,From that roof one can marvel at the neo-classical beauty,"It is much better to be in the garage looking out than to be outside looking in. The garage, built in 1969, is an ugly, dreary blot on the landscape. The garage's opened façade is like a grim stack of grey concrete pancakes.",http://www.theglobeandmail.com/news/british-columbia/vancouver-snapshots---then-and-now/article1357986/,1357986
2012-Page2-24,c31 : Marketing/Markets | m132 : Foreign Exchange News | nedi : Editorials | ccat : Corporate/Industrial News | m13 : Money/Forex Markets | mcat : Commodity/Financial Market News | ncat : Content Types | nfact : Factiva Filters | nfce : C&E Exclusion Filter | nfcpin : C&E Industry News Filter,Canada | United States | Cross-border shopping | Foreign exchange | Prices | Retail trade,"<p class=""articleParagraph enarticleParagraph"">Cross-border shopping will never be obsolete; two Statistics Canada studies published last week refute hopes for an eventual convergence of retail prices in the United States and Canada.</p><p class=""articleParagraph enarticleParagraph"">One of the studies shows – not surprisingly – that price-level differences are especially recalcitrant for food products that are subject to supply management or marketing boards, and for alcoholic beverages and tobacco – which are under the influence of excise taxes and provincial government monopolies.</p>",Document GLOB000020120110e81a0002e,stscan : Statistics Canada,A14,294 words,,"<p class=""articleParagraph enarticleParagraph"">Shoppers on both sides of the Canada-U.S. border might be expected to have virtuous effects, when they shift their demand to the country that has a lower price for a particular consumer good, sooner or later eliminating the difference – after taking into account the exchange rate. One of the two papers uses a method intended to replicate “the back-of-the-envelope calculation” by which many consumers compare prices in the two countries, adjusting for the currency difference.</p><p class=""articleParagraph enarticleParagraph"">In fact, American and Canadian prices do affect each other, but imperfectly. They move closer, but cross paths only briefly.</p><p class=""articleParagraph enarticleParagraph"">Curiously, when the Canadian dollar is falling, Canadians do not suffer as much from the rise of the U.S. dollar as would be expected – and do not fully benefit from greater purchasing power when the Canadian dollar strengthens.</p><p class=""articleParagraph enarticleParagraph"">Some factors in the divergences are readily understandable from people's ordinary experience. Though most Canadians live fairly close to the U.S. border, almost all cross-border shoppers incur some transportation costs, such as gasoline.</p><p class=""articleParagraph enarticleParagraph"">The American poet Longfellow was not thinking about cross-border shopping when he originated the metaphor of ships that pass in the night; nonetheless, his image expresses the all-too-fleeting convergences of Canadian and American prices.</p>",PRICES / CROSS-BORDER COMMERCE,,10 January 2012,Editorial,Shoppers in the night,ibcs : Business/Consumer Services,,©2012 The Globe and Mail Inc. All Rights Reserved.  ,English,,cana : Canada | usa : United States | namz : North America,The Globe and Mail Inc.,GLOB,The Globe and Mail,Shoppers on both sides of the Canada-U.S. border might be,"In fact, American and Canadian prices do affect each other, but imperfectly. They move closer, but cross paths only briefly.",http://www.theglobeandmail.com/opinion/editorials/shoppers-in-the-night-how-canadian-us-prices-fail-to-connect/article4085812/,4085812
2012-Page2-63,gsoc : Social Issues | gcrim : Crime/Courts | gimm : Asylum/Immigration | gpol : Domestic Politics | nedc : Commentary/Opinion | gcat : Political/General News | gcom : Society/Community/Work | gpir : Politics/International Relations | ncat : Content Types | nfact : Factiva Filters | nfcpex : FC&E Executive News Filter,Canada | Family law | Homosexuals | Immigration | Political | Same-sex marriage | Rob Nicholson,"<p class=""articleParagraph enarticleParagraph"">Teaches family law at McGill University and is president of Egale Canada</p><p class=""articleParagraph enarticleParagraph"">Where and when is equality realized? What steps are required to make it concrete? Those are the bigger questions I draw from Thursday's wild ride over the federal government's position on foreign gay and lesbian couples who wed in Canada.</p>",Document GLOB000020120113e81d0003m,,A13,674 words,,"<p class=""articleParagraph enarticleParagraph"">It began with a story in The Globe and Mail about a new position advanced by the federal government. It arose in a case concerning a challenge to the rule requiring 12 months of residency before divorce proceedings can be launched in a Canadian province.</p><p class=""articleParagraph enarticleParagraph"">Lawyers and scholars have known for years that the residency requirement would cause headaches for foreign couples. Thousands of them have flocked to Canada to marry since the first legal weddings at Toronto City Hall in 2003.</p><p class=""articleParagraph enarticleParagraph"">What nobody expected was that the federal government would deploy rules from a highly complex body of law called conflict of laws in order to undercut the equal-marriage provisions of which many Canadians, gay or straight, are rightly proud.</p><p class=""articleParagraph enarticleParagraph"">There's no need for divorce, the government's lawyer suggested – there isn't any marriage to begin with if the parties couldn't have married in their home country.</p><p class=""articleParagraph enarticleParagraph"">A firestorm of outrage greeted the story and, by afternoon, Justice Minister Rob Nicholson felt the need to respond, insisting that the government has no intention of reopening the marriage debate. He promised to investigate options to clarify the law so marriages done in Canada can be undone in Canada.</p><p class=""articleParagraph enarticleParagraph"">Prime Minister Stephen Harper said on Thursday he was unaware of what his lawyers were doing in this case. The charitable reading is that someone in the Department of Justice simply made a gaffe.</p><p class=""articleParagraph enarticleParagraph"">Those of us outraged by the initial news story in this matter may be heaving a sigh of relief, warily. But the need for caution remains. For one thing, it remains unknown what options the minister will consider and what will result.</p><p class=""articleParagraph enarticleParagraph"">For another, what's plain is that, even after a big victory such as same-sex marriage, equality can be eroded in incremental, bureaucratic ways. The big idea of equal marriage in Canada, associated with legal victories several years ago, needs to be sustained and protected over time.</p><p class=""articleParagraph enarticleParagraph"">Although Parliament passed the Civil Marriage Act in 2005, the federal government of the day didn't systematically review all the laws and policies that might need adjustment. The result is that legal problems for married gays and lesbians have persisted in administrative areas, such as immigration.</p><p class=""articleParagraph enarticleParagraph"">Parliament may have passed a law, but its intent is thwarted if changes aren't also made in the policy manuals by which laws are made real. Equality is also thwarted if government lawyers don't absorb the principles underlying that law into their conduct.</p><p class=""articleParagraph enarticleParagraph"">It's worth noting that the Harper government's lawyers are also involved in another matter that risks passing under the radar as a technicality. It concerns same-sex relationships formalized abroad.</p><p class=""articleParagraph enarticleParagraph"">In 2004, Britain legislated for gay equality by creating the civil partnership. The government there says a civil partnership is equal to marriage.</p><p class=""articleParagraph enarticleParagraph"">A Canadian citizen who had a civil partnership in Britain is seeking recognition of his relationship under Canadian law. The Ontario government raises no objection, but the federal government is intervening, at taxpayers' expense, to oppose recognizing the civil partnership as equivalent to a same-sex marriage performed in Canada.</p><p class=""articleParagraph enarticleParagraph"">The government's action undermines Britain's efforts to recognize the equality of same-sex relationships, but the Justice Minister has issued no public justification for his policy in that case.</p><p class=""articleParagraph enarticleParagraph"">As other groups have learned, equality is not something achieved in a moment of legal victory. It needs to be fought for repeatedly, in many contexts, over time. It requires vigilance and persistence, and all Canadians have a stake in making sure that our government doesn't use technicalities to undermine it.</p>",GAY MARRIAGE,,13 January 2012,Comment,It takes more than a verdict to win equality,,ROBERT LECKEY   ,©2012 The Globe and Mail Inc. All Rights Reserved.   ,English,,cana : Canada | namz : North America,The Globe and Mail Inc.,GLOB,The Globe and Mail,It began with a story in The Globe and Mail,Lawyers and scholars have known for years that the residency requirement would cause headaches for foreign couples. Thousands of them have flocked to Canada to marry since the first legal weddings at Toronto City Hall in 2003.,http://www.theglobeandmail.com/opinion/it-takes-more-than-a-verdict-to-win-equality/article1358246/,1358246
2012-Page1-62,c42 : Labor/Personnel Issues | gpol : Domestic Politics | nedc : Commentary/Opinion | ccat : Corporate/Industrial News | gcat : Political/General News | gpir : Politics/International Relations | ncat : Content Types | nfact : Factiva Filters | nfcpex : FC&E Executive News Filter | nfcpin : FC&E Industry News Filter,Ontario | Cutbacks | Economy | Government finance | Political | Dalton McGuinty | Don Drummond,"<p class=""articleParagraph enarticleParagraph"">aradwanski@globeandmail.com</p><p class=""articleParagraph enarticleParagraph"">At first glance, Dalton McGuinty had good reason to be flummoxed.</p>",Document GLOB000020120106e8160000n,,A5,642 words,,"<p class=""articleParagraph enarticleParagraph"">The message from the economist he had hand-picked to help steer Ontario's budget back toward balance was brutal. Previewing his coming report, Don Drummond publicly pronounced that economic growth had permanently stagnated under Mr. McGuinty's watch, meaning the province's entire model of program spending was no longer sustainable. And by the way, some of the Premier's proudest investments – smaller class sizes, for instance – were poor value and should be reversed.</p><p class=""articleParagraph enarticleParagraph"">But on Thursday, Mr. McGuinty and his advisers were sanguine.</p><p class=""articleParagraph enarticleParagraph"">They were evidently prepared for the stories that ran that morning in The Globe and Mail and the Toronto Star, likely because they were in the loop about Mr. Drummond giving interviews. And they seemed perfectly happy for the Premier to spend his first public event of the year talking about the economist's broadsides.</p><p class=""articleParagraph enarticleParagraph"">To understand why that is, it helps to bear in mind that – from the perspective of Mr. McGuinty and his Finance Minister, Dwight Duncan – Mr. Drummond's commission on public-service reform is increasingly being viewed as an exercise in table-setting.</p><p class=""articleParagraph enarticleParagraph"">The government might have hoped, when it struck the commission last spring, that answers to get out of deficit would be provided. But while it still might find considerable value in many of the report's roughly 400 recommendations, the report is unlikely to be the blueprint for the next provincial budget. Instead, the Liberals are clearly hoping that Mr. Drummond's doom-and-gloom will provide political cover for their own, somewhat milder austerity plan.</p><p class=""articleParagraph enarticleParagraph"">The Liberals probably won't commit to getting annual spending increases in health care below 3 per cent, as Mr. Drummond has proposed; they certainly won't scrap their own signature education policies. If they reject Mr. Drummond's unusually pessimistic forecast of 2-per-cent economic growth in perpetuity, and bring in some additional revenues by cancelling planned corporate tax cuts, they should generally be able to promise fewer cutbacks than the ones Mr. Drummond will call for.</p><p class=""articleParagraph enarticleParagraph"">But with a $16-billion deficit, and credit agencies threatening downgrades, whatever the government comes up with still won't be an easy sell.</p><p class=""articleParagraph enarticleParagraph"">Not to the workers in the broader public-sector – doctors and teachers among them – whose contracts will be up for negotiation this year. Not to the general public, which was hardly well-served by a recent election campaign in which all three provincial parties glossed over the leaner times ahead. And not to many Liberals themselves, including some of the ones around the cabinet table, who hardly got into public life because they were looking to cut things.</p><p class=""articleParagraph enarticleParagraph"">Those realities will be a little harder to deny now that Mr. Drummond is using his commission's platform to more or less pronounce that the province is in crisis.</p><p class=""articleParagraph enarticleParagraph"">Meanwhile, Mr. McGuinty will be able to point to Mr. Drummond's proposals as he tries to make his own more palatable. Where the economist has recommended what the Liberals planned to do anyway, his report will provide justification. And his more draconian ideas will be pointed to as grim inevitabilities if the Liberals' alternatives aren't adopted.</p><p class=""articleParagraph enarticleParagraph"">Of course, Mr. McGuinty's decision to appoint the commission could still blow up in his face. If Ontarians look closely at what Mr. Drummond has to say – at his implicit (and in some cases direct) criticism of the Liberals' record – they might reconsider the steady-hand pitch that helped the Premier get re-elected this past fall.</p><p class=""articleParagraph enarticleParagraph"">But Mr. McGuinty is making the best of a bad situation. And this week's communications, however counterintuitively, were viewed by his office as a good start.</p>",ONTARIO ECONOMY,,6 January 2012,Column,Why the doomsday report is not all bad for McGuinty,,ADAM RADWANSKI   ,©2012 The Globe and Mail Inc. All Rights Reserved.   ,English,,caon : Ontario | cana : Canada | namz : North America,The Globe and Mail Inc.,GLOB,The Globe and Mail,The message from the economist he had hand-picked to help,"But on Thursday, Mr. McGuinty and his advisers were sanguine.",http://www.theglobeandmail.com/news/politics/why-drummonds-doomsday-report-is-not-all-bad-for-the-premier/article543415/,543415
