Page-Article,NS,IPD,LP,AN,CO,PG,WC,CX,TD,CLM,CR,PD,SE,HD,IN,BY,CY,LA,ED,RE,PUB,SC,SN,Search_Query_1,Search_Query_2,URL,Article_ID
2012-Page2-72,gpol : Domestic Politics | gvote : Elections | nedc : Commentary/Opinion | npeo : People Profile | gcat : Political/General News | gpir : Politics/International Relations | ncat : Content Types | nfact : Factiva Filters | nfcpex : FC&E Executive News Filter,Canada | Biography | Political conventions | Bob Rae | Liberal Party,"<p class=""articleParagraph enarticleParagraph"">jsimpson@globeandmail.com</p><p class=""articleParagraph enarticleParagraph"">In the next federal election, perhaps in 2015, Bob Rae will have been gone from being the NDP premier of Ontario for two decades. By that time, a large swath of the Canadian voting public, especially those under 40, will remember nothing of those tumultuous times. Outside Ontario, chances are that voters would know nothing about those years, just as Ontarians wouldn't have clear opinions about Mike Harcourt's years as premier of B.C. or Don Getty's as premier of Alberta.</p>",Document GLOB000020120114e81e0001m,,F9,687 words,,"<p class=""articleParagraph enarticleParagraph"">Of course, the Harper Conservatives will try to remind people of Mr. Rae's time as premier and paint it with the blackest of colours. That's how the Conservatives do politics: Tear down opposition leaders. The Conservative campaign against Mr. Rae has already begun. It will continue through the next election because, barring unexpected developments, Mr. Rae will lead the Liberals in that campaign.</p><p class=""articleParagraph enarticleParagraph"">Mr. Rae is the “interim” Liberal leader. In theory, the leadership race is supposed to start late next winter; in practice, it has begun with only one candidate, Mr. Rae. There is, frankly, no one else. If there were, Mr. Rae could leave.</p><p class=""articleParagraph enarticleParagraph"">Liberals can dream of Justin Trudeau, except he has ruled out a leadership bid. They can think of New Brunswick MP Dominic LeBlanc, who might be ready for prime time some years from now. They can ponder Ontario Premier Dalton McGuinty. But the more they ponder, the more they'll realize that the last man standing will be Bob Rae.</p><p class=""articleParagraph enarticleParagraph"">Twice, the Liberals passed over Mr. Rae – once for Stéphane Dion, once for Michael Ignatieff. Mr. Rae was the most experienced, the best speaker, the more natural politician – yet, he lost twice.</p><p class=""articleParagraph enarticleParagraph"">Yes, his time as NDP premier counted against him with some Liberals, either because they couldn't forget his lacerating attacks on their party before he switched sides, or because they feared those years would be used against him to telling effect.</p><p class=""articleParagraph enarticleParagraph"">There were other, deeper reasons. Mr. Rae never gave the Liberals a clear enough narrative why he wanted to be leader and where he wanted to go. He offered the party himself and his talents, and they weren't enough.</p><p class=""articleParagraph enarticleParagraph"">When dealing with his time as NDP premier, Mr. Rae can't find the right narrative even now. Being a proud man, he defends those years, talking correctly about the difficulties of the recession Ontario faced, the challenges he overcame, the progress he made – although the generalized historical view is that of a buffeted and unsuccessful government. Ontarians apparently thought so. They decisively dumped the NDP at the first opportunity.</p><p class=""articleParagraph enarticleParagraph"">Having poured his reflections into books and speeches, Mr. Rae left the NDP. Here's where the narrative failed. In appealing to Liberals for their votes, he never explained why he and the Liberal Party could achieve objectives (other than taking power) that the NDP couldn't.</p><p class=""articleParagraph enarticleParagraph"">Mr. Rae never told Canadians why liberalism trumped social democracy, or why the Liberals reflected better than the NDP what he came to believe in. Now, the party desperately needs that narrative to bring at least some of those former Liberals back.</p><p class=""articleParagraph enarticleParagraph"">Mr. Rae can seek the leadership again as a way of personal vindication: At his age, and with his innate love of politics, it's hard to imagine him preferring a law firm to leading the Liberal Party. Politics was injected into his blood early – first at university, then as a young NDP MP. It still courses in his veins. He's a man of many interests beyond family, but one trumps all: politics.</p><p class=""articleParagraph enarticleParagraph"">Beleaguered Liberals could have fallen into factional infighting, as shattered parties often do. Under Mr. Rae, harmony has reigned in caucus, fundraising has picked up, media exposure has been won, and Mr. Rae has earned the highest badge of partisan honour: personal attacks from the Conservatives.</p><p class=""articleParagraph enarticleParagraph"">He pledged when becoming “interim” leader not to seek the job thereafter. A way will be found around that inconvenient, but not insuperable, impediment.</p>",LIBERAL PARTY,,14 January 2012,Comment Column,The last man standing will be … Bob Rae,,JEFFREY SIMPSON   ,©2012 The Globe and Mail Inc. All Rights Reserved.   ,English,,cana : Canada | caon : Ontario | namz : North America,The Globe and Mail Inc.,GLOB,The Globe and Mail,"Of course, the Harper Conservatives will try to remind people","Mr. Rae is the “interim” Liberal leader. In theory, the leadership race is supposed to start late next winter; in practice, it has begun with only one candidate, Mr. Rae. There is, frankly, no one else. If there were, Mr. Rae could leave.",http://www.theglobeandmail.com/opinion/the-last-man-standing-will-be-bob-rae/article4171202/,4171202
2012-Page1-19,gedu : Education | gpol : Domestic Politics | grel : Religion | gscho : School | nedi : Editorial | gcat : Political/General News | gcom : Society/Community/Work | gpir : Politics/International Relations | ncat : Content Types,Canada | Saskatchewan | Education | Ethnic groups | Private schools | Racial relations | Religion,"<p class=""articleParagraph enarticleParagraph"">Saskatchewan is heading in the wrong direction by adding a new category of private, faith-based schools eligible for public money. With the province becoming a destination for immigrants from all over the world, it has an opportunity to build public schools that will bring people together. Instead, the effect will be to emphasize separateness.</p><p class=""articleParagraph enarticleParagraph"">The province should weave diversity into the public system. Canada is full of examples of how to do this. Toronto's board offers after-school minority-language instruction. Edmonton offers special schools in the public system for minority languages. Montreal, despite some notable controversies, has been accommodating to people of many cultures and faiths.</p>",Document GLOB000020120103e8130000l,,A12,313 words,,"<p class=""articleParagraph enarticleParagraph"">The wave of immigration from Asia, Africa, the Caribbean and Latin America that has changed Vancouver, Montreal and Toronto broke late in Saskatchewan. It is now arriving. That will be a boon. There will be new sources of labour, new talents, new residents who can help drive economic growth, new sources of creativity, art and food.</p><p class=""articleParagraph enarticleParagraph"">The province's new rules give students in “qualified independent schools” 50 per cent of the per-student funding in the public system. The province already funds “associate schools” – another set of independent schools – to 80 per cent of the per-student public average.</p><p class=""articleParagraph enarticleParagraph"">A diverse population needs strong core institutions. It needs rallying points and meeting places, especially for its young people. John Tory, running for Ontario premier as a Progressive Conservative in 2007, was thrashed by voters when he tried to extend funding to faith-based schools (beyond the existing Roman Catholic system, which is publicly supported, and which, unfortunate though it is, has its roots in Canada's founding). He failed to appreciate how strongly the public favours integration and worries about isolation.</p><p class=""articleParagraph enarticleParagraph"">Diverse public schools are a multicultural society's best way to promote unity, while still preserving difference.</p>",EDUCATION,,3 January 2012,Editorial,Wrong on faith,,,©2012 The Globe and Mail Inc. All Rights Reserved.   ,English,,cana : Canada | cask : Saskatchewan | toron : Toronto | caon : Ontario | namz : North America,The Globe and Mail Inc.,GLOB,The Globe and Mail,"The wave of immigration from Asia, Africa, the Caribbean and",The province's new rules give students in “qualified independent schools” 50 per cent of the per-student funding in the public system. The province already funds “associate schools” – another set of independent schools – to 80 per cent of the per-student public average.,http://www.theglobeandmail.com/opinion/editorials/wrong-on-faith/article1357338/,1357338
2012-Page2-77,ccat : Corporate/Industrial News | gtvrad : Television/Radio | nedc : Commentary/Opinion | gcat : Political/General News | gent : Arts/Entertainment | ncat : Content Types | nfact : Factiva Filters | nfcpex : FC&E Executive News Filter,Canada's Handyman Challenge | Humour | Television | Mike Holmes,"<p class=""articleParagraph enarticleParagraph"">Who's the next Mike Holmes? Mike Holmes wants to find out. The GTA's DIY superstar aired his latest show this week, Canada's Handyman Challenge (HGTV), in which 12 amateur builders from across the country hang windows and caulk bathtubs to determine who can “make it right.” In this Globe T.O. exclusive, we bring you local audition clips of the would-be handymen who couldn't.</p><p class=""articleParagraph enarticleParagraph"">Clip 1 – Joe from Newmarket</p>",Document GLOB000020120114e81e0002s,,M5,618 words,,"<p class=""articleParagraph enarticleParagraph"">A nervous handyman in dark overalls and wearing a dust mask is lectured by Mike Holmes.</p><p class=""articleParagraph enarticleParagraph"">Mike Holmes [frustrated]: This is one of the most common things I see: A handyman who goes into people's homes to check for mould without even checking his own equipment.</p><p class=""articleParagraph enarticleParagraph"">Holmes rips the handyman's dust mask off his face, looks at it and shakes his head. He holds the interior up to the camera. It is flecked with dark spots – deadly mould.</p><p class=""articleParagraph enarticleParagraph"">Joe from Newmarket: I… I… I …</p><p class=""articleParagraph enarticleParagraph"">Mike Holmes: How long have you been wearing this thing?</p><p class=""articleParagraph enarticleParagraph"">Joe from Newmarket: Twenty minutes.</p><p class=""articleParagraph enarticleParagraph"">Mike Holmes: Be honest.</p><p class=""articleParagraph enarticleParagraph"">Joe from Newmarket [swallows nervously]: Three years.</p><p class=""articleParagraph enarticleParagraph"">Mike Holmes: How can you make a bathroom or garage right when you can't even make your own equipment right?</p><p class=""articleParagraph enarticleParagraph"">Clip 2 – Dave from Brampton</p><p class=""articleParagraph enarticleParagraph"">A nervous handyman in dark overalls is lectured by Mike Holmes.</p><p class=""articleParagraph enarticleParagraph"">Mike Holmes [frustrated]: All you guys think you've got what it takes to be a celebrity handyman, but you're all missing the most crucial piece of the puzzle: You have to look like the sixth member of The Village People.</p><p class=""articleParagraph enarticleParagraph"">Dave from Brampton: I… I… I…</p><p class=""articleParagraph enarticleParagraph"">Mike Holmes [disappointed]: Where's your wife beater? Why aren't your overalls a size too small? Your drill is drowning in that holster – you want a tight-fitting sleeve that the drill can bulge up against. And just look at how baggy your crotch is – you want to fill that void with spray-foam insulation, which will also boost your R-value.</p><p class=""articleParagraph enarticleParagraph"">Holmes picks up a nail gun and pierces the handyman's ear.</p><p class=""articleParagraph enarticleParagraph"">Mike Holmes [to the camera]: Because when it comes to non-scripted television shows in the “shelter” category, making it right means making it just a teeny bit gay.</p><p class=""articleParagraph enarticleParagraph"">Clip 3 – Ron from Mimico</p><p class=""articleParagraph enarticleParagraph"">A nervous handyman in dark overalls is lectured by Mike Holmes.</p><p class=""articleParagraph enarticleParagraph"">Mike Holmes [frustrated]: What's the difference between a handyman with his own TV show and one who's trying to get one?</p><p class=""articleParagraph enarticleParagraph"">Ron from Mimico: I… I… I…</p><p class=""articleParagraph enarticleParagraph"">Mike Holmes: The newbie does work in a home that was properly built in the first place.</p><p class=""articleParagraph enarticleParagraph"">Holmes inspects a tastefully renovated suburban kitchen.</p><p class=""articleParagraph enarticleParagraph"">Mike Holmes [disgusted]: It's the most basic rookie mistake. Just have a look around … the outlets are grounded. The grout work on the backsplash is superb. Aw, you gotta be kidding me. The overhang on this granite countertop is textbook.</p><p class=""articleParagraph enarticleParagraph"">Holmes angrily rips down a panel of ceiling drywall to reveal … nothing.</p><p class=""articleParagraph enarticleParagraph"">Mike Holmes [visibly angry]: The thing that really gets me about these contractors is they come in here, they do decent work, and then poof! – they're gone. What about the handyman who's trying to get his own TV show? What about the viewer who wants to see that handyman boil over with anger over shoddy workmanship? Do they care?</p><p class=""articleParagraph enarticleParagraph"">Getting on a stepladder, Holmes places his level atop the kitchen cabinets. The bubble floats precisely between the two black lines.</p><p class=""articleParagraph enarticleParagraph"">Mike Holmes: You can't make it right if it's already right to begin with.</p>",TELEVISION,SPECIAL TO THE GLOBE AND MAIL,14 January 2012,Globe Toronto Column,"Overalls aren't fit for rookies. Mike Holmes, make it right",i9741102 : Television Broadcasting | i97411 : Broadcasting | imed : Media,MARK SCHATZKER   ,©2012 The Globe and Mail Inc. All Rights Reserved.   ,English,,cana : Canada | caon : Ontario | namz : North America,The Globe and Mail Inc.,GLOB,The Globe and Mail,A nervous handyman in dark overalls and wearing a dust,Mike Holmes [frustrated]: This is one of the most common things I see: A handyman who goes into people's homes to check for mould without even checking his own equipment.,http://www.theglobeandmail.com/news/toronto/spray-foam-down-the-pants-tips-to-becoming-a-handyman-star/article1358345/,1358345
2012-Page1-45,gpol : Domestic Politics | nedi : Editorial | imf : International Monetary Fund | gcat : Political/General News | gpir : Politics/International Relations | ncat : Content Types | ocat : International Pol-Econ Organizations,Greece | Debt | Economy | Government finance | Political | Statements | Lucas Papademos | Pantelis Kapsis | EUROPEAN UNION,"The Greek government is flirting with danger, perhaps only as a negotiating tactic, but, if so, its bluff could be called. First, on Tuesday, its spokesman, Pantelis Kapsis, raised the possibility that Greece would leave the euro, if the negotiations on the next instalment of rescue measures – worth about €130-billion – do not make good progress. Then on Wednesday, Lucas Papademos, the Prime Minister, raised the prospect of “disorderly default” if those negotiations – with the so-called troika of the European Commission, the European Central Bank and the International Monetary Fund – do not succeed before early March.",Document GLOB000020120105e81500003,imonf : International Monetary Fund,A16,330 words,,"<p class=""articleParagraph enarticleParagraph"">These statements are not in themselves outrageous, but the acknowledgment of these risks from such sources is provocative. Mr. Papademos, almost universally classified as a technocrat as opposed to a politician, took office when the troika – and the international policy community as a whole – became fed up with the Greek political class. But the new government of experts is adopting its own rhetorical poses.</p><p class=""articleParagraph enarticleParagraph"">To whom are these messages addressed – to the troika and the bondholders, or to the Greek labour unions and the Greek people? Probably, to all of these. And that is as it should be. Some reports suggest that the Papademos government is on its way to obtaining significant concessions from both the international bondholders and the central body of Greek private-sector unions. The technocratic Prime Minister may be a politician, after all.</p><p class=""articleParagraph enarticleParagraph"">The euro and the euro zone can live on, with or without the small Greek economy. And one way or another, the Greeks will have to cope with lower price and wage levels for several years. What is to be avoided is disorderly default, panic, runs on banks, and an inability to conduct the most ordinary commercial transactions. If the European Union cannot prevent all that, its competence to do much of anything will be in doubt.</p><p class=""articleParagraph enarticleParagraph"">Meanwhile, Mr. Papademos appears to be playing his weak hand quite well.</p>",GREECE / DEBT CRISIS,,5 January 2012,Editorial,Playing euro poker,,,©2012 The Globe and Mail Inc. All Rights Reserved.   ,English,,greece : Greece | balkz : Balkan States | eecz : European Union Countries | eurz : Europe | medz : Mediterranean,The Globe and Mail Inc.,GLOB,The Globe and Mail,"These statements are not in themselves outrageous, but the acknowledgment","To whom are these messages addressed – to the troika and the bondholders, or to the Greek labour unions and the Greek people? Probably, to all of these. And that is as it should be. Some reports suggest that the Papademos government is on its way to obtaining significant concessions from both the in",http://www.theglobeandmail.com/opinion/editorials/playing-euro-poker/article4085377/,4085377
2012-Page2-46,ccat : Corporate/Industrial News | genv : Environmental News | gpol : Domestic Politics | nedc : Commentary/Opinion | gcat : Political/General News | gpir : Politics/International Relations | ncat : Content Types | nfact : Factiva Filters | nfcpex : FC&E Executive News Filter,Alberta | British Columbia | Canada | United States | Demonstrations | Development | Environment | Environmentalists | Lobbying | Oil industry | Pipelines | Political | Stephen Harper | Canadian Energy Pipelines Association | National Energy Board,"<p class=""articleParagraph enarticleParagraph"">OTTAWA -- cclark@globeandmail.com</p><p class=""articleParagraph enarticleParagraph"">Who would expect Stephen Harper's cry of injustice in the oil sands to be about the colour of foreign money?</p>",Document GLOB000020120112e81c00030,,A14,625 words,,"<p class=""articleParagraph enarticleParagraph"">Mr. Harper made the complaint, then Natural Resources Minister Joe Oliver followed in an open letter: Foreign money is interfering with Canadian decisions about the Northern Gateway Pipeline, which would transport Alberta oil to a B.C. port so it could be shipped overseas. It came after some foreigner-fearmongering from oil-sands advocacy group ethicaloil.org, which, working as Ottawa's cat's paw, asked Mr. Oliver to “ban foreigners” from public hearings on the pipeline.</p><p class=""articleParagraph enarticleParagraph"">Canada is economically dependent on trade, seeking to attract investors and aspiring to influence the world. The pipeline is partly financed by foreign investors to sell oil to Asia, and it's opposed (among others) by those who fear it will speed global warming. This is international business and geopolitics, and the front lines of global debate, the crossing of Canada and the world. Canada's whining about some foreign funding of activists.</p><p class=""articleParagraph enarticleParagraph"">There really is, as Mr. Harper says, a big issue of national strategy around selling energy to Asia, rather than just the U.S., which requires pipelines to the West Coast. There really are environmental groups that oppose developing the oil sands at all. But to pretend what matters is preventing foreign money from influencing Canadian resource decisions is parochial and disingenuous.</p><p class=""articleParagraph enarticleParagraph"">Heaven forfend that foreign interests try to influence Canadian pipeline policy by funding organizations here. Like the Canadian Energy Pipelines Association. Three out of 10 of their member companies are subsidiaries of American ones : Spectra Energy, Kinder Morgan Canada, and <span class=""companylink"">Plains Midstream Canada</span>, controlled by Plains All American.</p><p class=""articleParagraph enarticleParagraph"">Over four days in November, CEPA lobbyists met with 30 MPs (28 Tories including two ministers), six deputy ministers, and a dozen other senior officials.</p><p class=""articleParagraph enarticleParagraph""><span class=""companylink"">Conoco Phillips</span>, developing an Alaskan gas pipeline that would cut through Canada, also lobbies. On other issues, like Chinese takeovers of Canadian oil firms, companies like <span class=""companylink"">China National Offshore Oil Corporation</span> get meetings, as they did in November, with senior Canadian officials and Mr. Oliver. Foreign governments care, too.</p><p class=""articleParagraph enarticleParagraph"">Mr. Harper announced Wednesday that he'll make his second trip to China in February. His new priority, selling oil to Asia, will surely be a hot topic, as well as adding to $10-billion in Chinese oil investment.</p><p class=""articleParagraph enarticleParagraph"">It isn't wrong for foreign oil companies to discuss projects with Canadian officials, or for foreign backers of Northern Gateway, like France's Total and China's Sinopec, to support it at hearings. Or for environmental groups to take American sums to oppose it. The panel's reviewing evidence, not taking a poll.</p><p class=""articleParagraph enarticleParagraph"">Mr. Oliver's letter complained that environmentalists with foreign money will slow the review, and the process should be changed. For a government in power six years to say that on the eve of hearings they deem crucial is like admitting to sleeping on the job.</p><p class=""articleParagraph enarticleParagraph"">They woke up after losing another pipeline battle last fall to environmentalists, when U.S. President Barack Obama delayed a decision on the Keystone XL pipeline to the Gulf Coast. They went looking for an opponent here, because it's better to be on offence. So Mr. Oliver caricatured the funders as “billionaire socialists from the United States” – who would sympathize with those?</p><p class=""articleParagraph enarticleParagraph"">It's a nervy response that looks like browbeating a panel, shutting down critics, and whiny, selective xenophobia. This is a serious issue, and Ottawa's busy cutting targets out of cardboard.</p>",ENERGY SECTOR,,12 January 2012,Column,"Foreign influence cuts both ways; If U.S.-based oil companies can support Canadian projects, why can't U.S.-based environmental groups oppose them?",i1 : Energy | i13 : Crude Oil/Natural Gas,CAMPBELL CLARK   ,©2012 The Globe and Mail Inc. All Rights Reserved.   ,English,,cana : Canada | china : China | cabc : British Columbia | ottaw : Ottawa | usa : United States | apacz : Asia Pacific | asiaz : Asia | bric : BRIC Countries | caon : Ontario | chinaz : Greater China | devgcoz : Emerging Market Countries | dvpcoz : Developing Economies | easiaz : Eastern Asia | namz : North America,The Globe and Mail Inc.,GLOB,The Globe and Mail,"Mr. Harper made the complaint, then Natural Resources Minister Joe","Canada is economically dependent on trade, seeking to attract investors and aspiring to influence the world. The pipeline is partly financed by foreign investors to sell oil to Asia, and it's opposed (among others) by those who fear it will speed global warming. This is international business and ge",http://www.theglobeandmail.com/news/politics/in-canadas-energy-sector-foreign-influence-cuts-both-ways/article1358158/,1358158
